{
  "$schema":"https://json-schema.org/draft/2020-12/schema",
  "type":"object","additionalProperties":false,
  "required":["schemaVersion","generatedAt","oneAppContract","expectedSystems","engines"],
  "properties":{
    "$schema":{"type":"string"},"schemaVersion":{"const":1},"generatedAt":{"type":"string"},
    "oneAppContract":{"const":true},
    "expectedSystems":{"type":"array","items":{"type":"string"},"uniqueItems":true},
    "engines":{"type":"array","items":{"$ref":"#/$defs/engine"}}
  },
  "$defs":{"engine":{"type":"object","additionalProperties":false,
    "required":["id","systems","route","status","source","blocker","gates","shipped"],
    "properties":{"id":{"type":"string","pattern":"^[a-z0-9-]+$"},"systems":{"type":"array","minItems":1,"uniqueItems":true,"items":{"type":"string"}},"route":{"enum":["libretro-core","native-adapter","container-adapter"]},"status":{"const":"research"},"source":{"type":"object","additionalProperties":false,"required":["repository","commit"],"properties":{"repository":{"type":"string","pattern":"^https://"},"commit":{"type":"string","pattern":"^[0-9a-f]{40}$"},"archive":{"type":"string"},"archiveSha256":{"type":"string","pattern":"^[0-9a-f]{64}$"}}},"blocker":{"type":"string","minLength":20},"gates":{"type":"object","additionalProperties":false,"required":["source","license","dependencies","androidArm64","firmware","legalContent","renderer","state","performance","device"],"properties":{"source":{"type":"boolean"},"license":{"type":"boolean"},"dependencies":{"type":"boolean"},"androidArm64":{"type":"boolean"},"firmware":{"type":"boolean"},"legalContent":{"type":"boolean"},"renderer":{"type":"boolean"},"state":{"type":"boolean"},"performance":{"type":"boolean"},"device":{"type":"boolean"}}},"shipped":{"const":false}}
  }}
}
