{
  "$schema": "./phase3-registry.schema.json",
  "schemaVersion": 1,
  "generatedAt": "2026-08-07",
  "oneAppContract": true,
  "expectedSystems": ["3do", "psvita", "wiiu", "switch", "ps3", "xbox", "xbox360", "windows"],
  "engines": [
    {"id":"opera","systems":["3do"],"route":"libretro-core","status":"research","source":{"repository":"https://github.com/libretro/opera-libretro","commit":"636a8dd6340bce7073168ddefd29841fc5e2d213","archive":"https://codeload.github.com/libretro/opera-libretro/tar.gz/636a8dd6340bce7073168ddefd29841fc5e2d213","archiveSha256":"cb6055946b498858ed006ed69850229171ed0a18af85bc8452b2218f94d9fb78"},"blocker":"License/non-commercial provenance, firmware, legal content, Android build, state, performance, and devices are unqualified.","gates":{"source":false,"license":false,"dependencies":false,"androidArm64":false,"firmware":false,"legalContent":false,"renderer":false,"state":false,"performance":false,"device":false},"shipped":false},
    {"id":"vita3k","systems":["psvita"],"route":"native-adapter","status":"research","source":{"repository":"https://github.com/Vita3K/Vita3K-Android","commit":"72cee295b9a2cee2f708d0a047aee8841e55159f","archive":"https://codeload.github.com/Vita3K/Vita3K-Android/tar.gz/72cee295b9a2cee2f708d0a047aee8841e55159f","archiveSha256":"10ee51e6216bb7ffe751d15a955b02c10c3f79165bf7532a5ec83c4a49cdf47a"},"blocker":"Android native-adapter boundary, firmware, content, state API, license closure, performance, and devices are unqualified.","gates":{"source":false,"license":false,"dependencies":false,"androidArm64":false,"firmware":false,"legalContent":false,"renderer":false,"state":false,"performance":false,"device":false},"shipped":false},
    {"id":"cemu","systems":["wiiu"],"route":"native-adapter","status":"research","source":{"repository":"https://github.com/cemu-project/Cemu","commit":"daacdda0bab55dd78a2b5aac2c12d6ebe8c8e868","archive":"https://codeload.github.com/cemu-project/Cemu/tar.gz/daacdda0bab55dd78a2b5aac2c12d6ebe8c8e868","archiveSha256":"6e29804a6a7900ec35a4197b91044e0ae752ad44af3437656a86afcd176b397b"},"blocker":"Android ARM64 integration, dual-screen routing, firmware/content, state API, dependency closure, performance, and devices are unqualified.","gates":{"source":false,"license":false,"dependencies":false,"androidArm64":false,"firmware":false,"legalContent":false,"renderer":false,"state":false,"performance":false,"device":false},"shipped":false},
    {"id":"eden","systems":["switch"],"route":"native-adapter","status":"research","source":{"repository":"https://git.eden-emu.dev/eden-emu/eden","commit":"5ec94b19714f75489cdfc62d890d2f94d45514ce"},"blocker":"Stable upstream release identity, keys/firmware flow, native adapter, state API, dependency closure, performance, and devices are unqualified.","gates":{"source":false,"license":false,"dependencies":false,"androidArm64":false,"firmware":false,"legalContent":false,"renderer":false,"state":false,"performance":false,"device":false},"shipped":false},
    {"id":"aps3e","systems":["ps3"],"route":"native-adapter","status":"research","source":{"repository":"https://github.com/aenu1/aps3e","commit":"b5ae1af50d5e2f3b705506e7380a4504e086840b"},"blocker":"Source/dependency and RPCS3-derived license audit, firmware flow, native adapter, state API, performance, and devices are unqualified.","gates":{"source":false,"license":false,"dependencies":false,"androidArm64":false,"firmware":false,"legalContent":false,"renderer":false,"state":false,"performance":false,"device":false},"shipped":false},
    {"id":"xemu","systems":["xbox"],"route":"native-adapter","status":"research","source":{"repository":"https://github.com/xemu-project/xemu","commit":"295c13e972338879ff74a3e9f0dd57b35e148c60"},"blocker":"No qualified Android ARM64 port; BIOS/HDD, native adapter, state, dependency closure, performance, and devices are open.","gates":{"source":false,"license":false,"dependencies":false,"androidArm64":false,"firmware":false,"legalContent":false,"renderer":false,"state":false,"performance":false,"device":false},"shipped":false},
    {"id":"xenia","systems":["xbox360"],"route":"native-adapter","status":"research","source":{"repository":"https://github.com/xenia-project/xenia","commit":"95a5c3ee250f80c3b9d139658649d9ffb6db3eec","archive":"https://codeload.github.com/xenia-project/xenia/tar.gz/95a5c3ee250f80c3b9d139658649d9ffb6db3eec","archiveSha256":"1e880098d26a2f5d55ca2aa8b4afe0e2a85d4d260df18350e9d75da582846471"},"blocker":"No qualified Android ARM64/JIT renderer; native adapter, content, state, dependencies, performance, and devices are open.","gates":{"source":false,"license":false,"dependencies":false,"androidArm64":false,"firmware":false,"legalContent":false,"renderer":false,"state":false,"performance":false,"device":false},"shipped":false},
    {"id":"winlator","systems":["windows"],"route":"container-adapter","status":"research","source":{"repository":"https://github.com/brunodev85/winlator","commit":"fb66541b93a4eb3ee585a433b4c7b20544d58e40"},"blocker":"Wine/Box64/container dependency closure, per-game lifecycle/state contract, controls, performance, and devices are unqualified.","gates":{"source":false,"license":false,"dependencies":false,"androidArm64":false,"firmware":false,"legalContent":false,"renderer":false,"state":false,"performance":false,"device":false},"shipped":false}
  ]
}
